{
  "story_plan": {
    "format": "steps",
    "slides": [
      {
        "headline": "Invest in S&P 500 from France?",
        "slide_number": 1,
        "body": "US ETFs have rules. But you can still get exposure!",
        "visual_concept": "French flag with a superimposed, slightly faded US ETF symbol, looking blocked.",
        "role": "intro"
      },
      {
        "visual_concept": "A red 'X' over a generic US stock certificate.",
        "role": "step_1",
        "body": "EU rules prevent French brokers from selling most US-domiciled ETFs. It's for investor protection.",
        "slide_number": 2,
        "headline": "EU Regulations Block US ETFs"
      },
      {
        "headline": "Discover UCITS ETFs",
        "slide_number": 3,
        "body": "UCITS ETFs are EU-regulated and track indices like the S&P 500. Same exposure, EU-approved.",
        "role": "step_2",
        "visual_concept": "A green checkmark next to 'UCITS' logo, with a graph showing upward trend."
      },
      {
        "visual_concept": "Icons representing PEA and Assurance Vie (e.g., a French Marianne coin and a shield).",
        "role": "step_3",
        "body": "Use French accounts like PEA or Assurance Vie for potential tax benefits. Invest smart!",
        "slide_number": 4,
        "headline": "Invest via PEA or Assurance Vie"
      }
    ]
  },
  "issues_found": [
    "Blog post title could be more engaging. Some sentences in the blog post are a bit long or could be simplified. Story concept was a good start but needed fleshing out into specific slide content."
  ],
  "publish_ready": true,
  "overall_score": 8,
  "issues_fixed": [
    "Corrected blog post title to be more direct and benefit-oriented. Simplified language and flow for better readability. Added emphasis on key terms like UCITS, PEA, and Assurance Vie. Ensured blog post word count is within range. Created a 4-slide Instagram story plan with clear headlines, concise body text, and specific visual concepts for each slide, following the 'steps' format."
  ],
  "approved": true,
  "blog_post": {
    "title": "Your S&P 500 ETF Solution: How to Invest from France",
    "script_notes": "Emphasize the regulatory reason for the block in the first section. Clearly define UCITS ETFs and their benefit. Highlight the tax advantages of PEA and Assurance Vie. Maintain a friendly and encouraging tone throughout.",
    "text": "Ever dreamed of investing in popular US ETFs, like those tracking the S&P 500, but hit a roadblock buying them from France? You're not alone. It's a common frustration for EU residents, leaving us wondering why we can't access the same investments available elsewhere.\n\nThe main reason? Regulations. The EU has specific rules for financial products designed to protect investors. Most US-domiciled ETFs don't meet these EU requirements. This means brokers in France and across the EU are generally restricted from selling them to everyday investors. It’s not your broker being difficult; they're following strict rules. This regulatory difference is the primary hurdle to directly buying many US ETFs, even those tracking major indices like the S&P 500.\n\nSo, if you can't buy US ETFs directly, how can you get that S&P 500 exposure, which represents a stake in the 500 largest US companies? The key is to look for **UCITS ETFs**. UCITS stands for Undertakings for Investment in Transferable Securities. Essentially, these ETFs are regulated within the EU and comply with European investor protection rules. They are specifically designed for European investors. Many UCITS ETFs are structured to mirror major global indices, including the S&P 500. So, while you won't be buying an ETF *issued* in the US, you can buy a UCITS ETF that offers the exact same investment exposure to the S&P 500. It's like getting the same flavor of ice cream, just made in a different factory approved for sale in your region.\n\nNow that you know about UCITS ETFs, the next step is learning how to invest in them effectively from France. You have excellent options, and choosing the right one can even provide tax advantages.\n\nMany French residents utilize a **PEA (Plan d'Épargne en Actions)**. This is a French stock savings account. Investing in eligible ETFs within a PEA can lead to largely tax-free capital gains and dividends after five years – a significant benefit!\n\nAnother popular choice is an **Assurance Vie** contract. This is a life insurance policy that can also hold investments, offering flexibility and potential tax benefits on withdrawals and inheritance.\n\nFor those who don’t qualify for a PEA or desire broader investment options, a standard **compte-titres** (securities account) is available. However, it doesn't offer the same tax advantages as a PEA or Assurance Vie.\n\nSelecting the best account depends on your investment goals and tax situation. The crucial point is that through UCITS ETFs and established French investment accounts like the PEA or Assurance Vie, you *can* effectively invest in the US market and gain exposure to indices like the S&P 500. You can do this without the regulatory complications of trying to buy US-domiciled funds directly. It’s about working with the system to your advantage.\n\nThis week, take time to research UCITS ETFs that track the S&P 500. Many brokers popular in France, especially those offering PEA or Assurance Vie accounts, will list these UCITS options. Understanding your choices is the first powerful step toward confidently building your investment portfolio.\n\nKeep learning, keep investing, and remember that navigating international markets from France is entirely achievable!"
  },
  "topic": "How to but an American ETF from France like sp500?",
  "slug": "how-to-but-an-american-etf-from-france-like-sp500"
}